{"schema_version":"1.0","project_id":"demo-redraw","project_name":"普通 CAD 重绘示例","task_type":"redraw_from_reference","runtime_mode":"plain_autocad","product":"autocad","reference_documents":[{"id":"ref","type":"PDF","path":"inputs/reference.pdf","read_only":true}],"target_documents":[],"workflow":"04_redraw","approval_level":"L1_DRY_RUN","production_allowed":false,"production_d1_allowed":false,"preferred_backend":"offline","fallback_backend":"offline","visual_review_required":true,"engineering_review_required":true,"protected_regions":[],"excluded_layers":[],"excluded_objects":[],"options":{}}
