{"schema_version":"1.0","project_id":"demo-offline-plan","project_name":"离线 PDF 转 CAD 计划示例","task_type":"analyze_reference","runtime_mode":"offline_analysis","product":"offline","reference_documents":[{"id":"ref","type":"PDF","path":"inputs/reference.pdf","read_only":true}],"target_documents":[],"workflow":"02_reference_analysis","approval_level":"L1_DRY_RUN","production_allowed":false,"production_d1_allowed":false,"preferred_backend":"offline","fallback_backend":"offline","visual_review_required":true,"engineering_review_required":true,"protected_regions":[],"excluded_layers":[],"excluded_objects":[],"options":{}}
