{"schema_version":"1.0","project_id":"demo-compare","project_name":"普通 CAD 比较示例","task_type":"compare_drawings","runtime_mode":"plain_autocad","product":"autocad","reference_documents":[{"id":"ref","type":"DWG","path":"inputs/reference.dwg","read_only":true}],"target_documents":[{"id":"target","type":"DWG","path":"inputs/target.dwg","read_only":true}],"workflow":"08_visual_review","approval_level":"L0_READ_ONLY","production_allowed":false,"production_d1_allowed":false,"preferred_backend":"offline","fallback_backend":"offline","visual_review_required":true,"engineering_review_required":true,"protected_regions":[],"excluded_layers":[],"excluded_objects":[],"options":{"content_access":"deferred_to_approved_backend"}}
