{"schema_version":"1.0","project_id":"demo-hvac","project_name":"天正暖通只读检查示例","task_type":"inspect_drawing","runtime_mode":"tianzheng_hvac","product":"tianzheng_hvac","reference_documents":[],"target_documents":[{"id":"target","type":"DWG","path":"inputs/hvac.dwg","read_only":true}],"workflow":"01_inspect","approval_level":"L0_READ_ONLY","production_allowed":false,"production_d1_allowed":false,"preferred_backend":"offline","fallback_backend":"offline","visual_review_required":true,"engineering_review_required":true,"protected_regions":[],"excluded_layers":[],"excluded_objects":[],"options":{"write_support":"INTERFACE_ONLY"}}
