{"schema_version":"1.0","project_id":"synthetic","project_name":"合成离线测试","task_type":"inspect_drawing","runtime_mode":"offline_analysis","product":"offline","reference_documents":[{"id":"ref","type":"PDF","path":"fixture://synthetic.pdf","read_only":true}],"target_documents":[],"workflow":"01_inspect","approval_level":"L0_READ_ONLY","production_allowed":false,"production_d1_allowed":false,"preferred_backend":"offline","fallback_backend":"offline","visual_review_required":true,"engineering_review_required":true,"protected_regions":[],"excluded_layers":[],"excluded_objects":[],"options":{"synthetic":true}}
