{"schema_version":"1.0","project_id":"demo-water","project_name":"天正给排水补全示例","task_type":"sandbox_edit","runtime_mode":"tianzheng_water","product":"tianzheng_water","reference_documents":[{"id":"ref","type":"PDF","path":"inputs/reference.pdf","read_only":true}],"target_documents":[{"id":"sandbox","type":"DWG","path":"sandbox/candidate.dwg","read_only":false}],"workflow":"06_sandbox_completion","approval_level":"L1_DRY_RUN","production_allowed":false,"production_d1_allowed":false,"preferred_backend":"offline","fallback_backend":"offline","visual_review_required":true,"engineering_review_required":true,"protected_regions":[{"id":"boundary-a","rule":"NO_WRITE"}],"excluded_layers":[],"excluded_objects":[],"options":{"native_topology_verified":"NOT_VERIFIED"}}
