{"schema_version":"1.0","project_id":"replace-me","project_name":"替换为项目名称","task_type":"inspect_drawing","runtime_mode":"auto_detect","product":"auto","reference_documents":[],"target_documents":[],"workflow":"00_select_runtime","approval_level":"L0_READ_ONLY","production_allowed":false,"production_d1_allowed":false,"preferred_backend":"offline","fallback_backend":"offline","visual_review_required":true,"engineering_review_required":true,"protected_regions":[],"excluded_layers":[],"excluded_objects":[],"options":{}}
